product_name,price,description,image_url,lost_description,image_path,category,searchable_text
Galaxy Tab 3,$107.99,"7"", 8GB, Wi-Fi, Android 4.2, Yellow",https://webscraper.io/images/test-sites/e-commerce/items/cart2.png,Someone might have seen a galaxy tab 3 near the hostel area.,images/product_129_0.jpg,electronics,"Galaxy Tab 3 7"", 8GB, Wi-Fi, Android 4.2, Yellow Someone might have seen a galaxy tab 3 near the hostel area. electronics"
Acer Predator...,$1187.98,"Acer Predator Helios 300 (PH317-51), 17.3"" FHD IPS, Core i7-7700HQ. 8GB, 128GB SSD +1TB, GeForce GTX 1050Ti 4GB, Linux + Windows 10 Home",https://webscraper.io/images/test-sites/e-commerce/items/cart2.png,I think I left my acer predator... in the lecture hall.,images/product_89_0.jpg,electronics,"Acer Predator... Acer Predator Helios 300 (PH317-51), 17.3"" FHD IPS, Core i7-7700HQ. 8GB, 128GB SSD +1TB, GeForce GTX 1050Ti 4GB, Linux + Windows 10 Home I think I left my acer predator... in the lecture hall. electronics"
Acer Predator...,$1221.58,"Acer Predator Helios 300 (PH317-51), 17.3"" FHD IPS, Core i7-7700HQ, 8GB, 1TB + 128GB SSD, GeForce GTX 1050 Ti 4GB, Windows 10 Home",https://webscraper.io/images/test-sites/e-commerce/items/cart2.png,A acer predator... was reported missing near the main gate.,images/product_95_0.jpg,electronics,"Acer Predator... Acer Predator Helios 300 (PH317-51), 17.3"" FHD IPS, Core i7-7700HQ, 8GB, 1TB + 128GB SSD, GeForce GTX 1050 Ti 4GB, Windows 10 Home A acer predator... was reported missing near the main gate. electronics"
ThinkPad Yoga,$1223.99,"12.5"" Touch, Core i5 4200U, 8GB, 500GB + 16GB SSD Cache, Windows",https://webscraper.io/images/test-sites/e-commerce/items/cart2.png,My thinkpad yoga went missing near the campus cafeteria.,images/product_12_0.jpg,electronics,"ThinkPad Yoga 12.5"" Touch, Core i5 4200U, 8GB, 500GB + 16GB SSD Cache, Windows My thinkpad yoga went missing near the campus cafeteria. electronics"
MSI GS63 7RD S...,$1179,"MSI GS63 7RD Stealth, 15.6"" FHD IPS, Core i7-7700HQ, 8GB, 256GB SSD, GeForce GTX 1050 2GB, DOS + Windows 10 Home",https://webscraper.io/images/test-sites/e-commerce/items/cart2.png,My msi gs63 7rd s... went missing near the campus cafeteria.,images/product_87_0.jpg,electronics,"MSI GS63 7RD S... MSI GS63 7RD Stealth, 15.6"" FHD IPS, Core i7-7700HQ, 8GB, 256GB SSD, GeForce GTX 1050 2GB, DOS + Windows 10 Home My msi gs63 7rd s... went missing near the campus cafeteria. electronics"
ThinkPad Yoga,$1223.99,"12.5"" Touch, Core i5 4200U, 8GB, 500GB + 16GB SSD Cache, Windows",https://webscraper.io/images/test-sites/e-commerce/items/cart2.png,My thinkpad yoga went missing near the campus cafeteria.,images/product_12_0.jpg,electronics,"ThinkPad Yoga 12.5"" Touch, Core i5 4200U, 8GB, 500GB + 16GB SSD Cache, Windows My thinkpad yoga went missing near the campus cafeteria. electronics"
Lenovo V510 Bl...,$498.23,"Lenovo V510 Black, 15.6"" FHD, Core i3-7100U, 4GB, 128GB SSD, Windows 10 Pro",https://webscraper.io/images/test-sites/e-commerce/items/cart2.png,I lost my lenovo v510 bl... while commuting this morning.,images/product_62_0.jpg,electronics,"Lenovo V510 Bl... Lenovo V510 Black, 15.6"" FHD, Core i3-7100U, 4GB, 128GB SSD, Windows 10 Pro I lost my lenovo v510 bl... while commuting this morning. electronics"
Acer Extensa 1...,$439.73,"Acer Extensa 15 (2540) Black, 15.6"" HD, Core i5-7200U, 4GB, 500GB, Linux",https://webscraper.io/images/test-sites/e-commerce/items/cart2.png,My acer extensa 1... went missing near the campus cafeteria.,images/product_49_0.jpg,electronics,"Acer Extensa 1... Acer Extensa 15 (2540) Black, 15.6"" HD, Core i5-7200U, 4GB, 500GB, Linux My acer extensa 1... went missing near the campus cafeteria. electronics"
Acer Predator...,$1221.58,"Acer Predator Helios 300 (PH317-51), 17.3"" FHD IPS, Core i7-7700HQ, 8GB, 1TB + 128GB SSD, GeForce GTX 1050 Ti 4GB, Windows 10 Home",https://webscraper.io/images/test-sites/e-commerce/items/cart2.png,A acer predator... was reported missing near the main gate.,images/product_95_0.jpg,electronics,"Acer Predator... Acer Predator Helios 300 (PH317-51), 17.3"" FHD IPS, Core i7-7700HQ, 8GB, 1TB + 128GB SSD, GeForce GTX 1050 Ti 4GB, Windows 10 Home A acer predator... was reported missing near the main gate. electronics"
ThinkPad T540p,$1178.99,"15.6"", Core i5-4200M, 4GB, 500GB, Win7 Pro 64bit",https://webscraper.io/images/test-sites/e-commerce/items/cart2.png,I lost my thinkpad t540p while commuting this morning.,images/product_2_0.jpg,electronics,"ThinkPad T540p 15.6"", Core i5-4200M, 4GB, 500GB, Win7 Pro 64bit I lost my thinkpad t540p while commuting this morning. electronics"
Amazon Kindle,$103.99,"6"" screen, wifi",https://webscraper.io/images/test-sites/e-commerce/items/cart2.png,A amazon kindle was reported missing near the main gate.,images/product_120_0.jpg,electronics,"Amazon Kindle 6"" screen, wifi A amazon kindle was reported missing near the main gate. electronics"
Dell Vostro 15,$488.78,"Dell Vostro 15 (3568) Black, 15.6"" FHD, Core i5-7200U, 4GB, 128GB SSD, Radeon R5 M420 2GB, Linux",https://webscraper.io/images/test-sites/e-commerce/items/cart2.png,I misplaced my dell vostro 15 somewhere in the library.,images/product_15_0.jpg,electronics,"Dell Vostro 15 Dell Vostro 15 (3568) Black, 15.6"" FHD, Core i5-7200U, 4GB, 128GB SSD, Radeon R5 M420 2GB, Linux I misplaced my dell vostro 15 somewhere in the library. electronics"
Aspire E1-510,$306.99,"15.6"", Pentium N3520 2.16GHz, 4GB, 500GB, Linux",https://webscraper.io/images/test-sites/e-commerce/items/cart2.png,A aspire e1-510 was reported missing near the main gate.,images/product_1_0.jpg,electronics,"Aspire E1-510 15.6"", Pentium N3520 2.16GHz, 4GB, 500GB, Linux A aspire e1-510 was reported missing near the main gate. electronics"
Asus VivoBook...,$1235.49,"Asus VivoBook Pro 15 N580VN-FI006T Gold Metal, 15.6"" UHD, Core i7-7700HQ, 16GB, 1TB + 256GB SSD, GeForce MX150 2GB, Windows 10 Home, Eng kbd",https://webscraper.io/images/test-sites/e-commerce/items/cart2.png,My asus vivobook... went missing near the campus cafeteria.,images/product_96_0.jpg,electronics,"Asus VivoBook... Asus VivoBook Pro 15 N580VN-FI006T Gold Metal, 15.6"" UHD, Core i7-7700HQ, 16GB, 1TB + 256GB SSD, GeForce MX150 2GB, Windows 10 Home, Eng kbd My asus vivobook... went missing near the campus cafeteria. electronics"
Lenovo V510 Bl...,$498.23,"Lenovo V510 Black, 15.6"" FHD, Core i3-7100U, 4GB, 128GB SSD, Windows 10 Pro",https://webscraper.io/images/test-sites/e-commerce/items/cart2.png,I lost my lenovo v510 bl... while commuting this morning.,images/product_62_0.jpg,electronics,"Lenovo V510 Bl... Lenovo V510 Black, 15.6"" FHD, Core i3-7100U, 4GB, 128GB SSD, Windows 10 Pro I lost my lenovo v510 bl... while commuting this morning. electronics"
Amazon Kindle,$103.99,"6"" screen, wifi",https://webscraper.io/images/test-sites/e-commerce/items/cart2.png,A amazon kindle was reported missing near the main gate.,images/product_120_0.jpg,electronics,"Amazon Kindle 6"" screen, wifi A amazon kindle was reported missing near the main gate. electronics"
Lenovo V110-15...,$465.95,"Lenovo V110-15IKB, 15.6"" HD, Core i5-7200U, 4GB, 500GB, DOS",https://webscraper.io/images/test-sites/e-commerce/items/cart2.png,Someone might have seen a lenovo v110-15... near the hostel area.,images/product_53_0.jpg,electronics,"Lenovo V110-15... Lenovo V110-15IKB, 15.6"" HD, Core i5-7200U, 4GB, 500GB, DOS Someone might have seen a lenovo v110-15... near the hostel area. electronics"
Acer Extensa 1...,$439.73,"Acer Extensa 15 (2540) Black, 15.6"" HD, Core i5-7200U, 4GB, 500GB, Linux",https://webscraper.io/images/test-sites/e-commerce/items/cart2.png,My acer extensa 1... went missing near the campus cafeteria.,images/product_49_0.jpg,electronics,"Acer Extensa 1... Acer Extensa 15 (2540) Black, 15.6"" HD, Core i5-7200U, 4GB, 500GB, Linux My acer extensa 1... went missing near the campus cafeteria. electronics"
Sony Xperia,$118.99,"GPS, waterproof",https://webscraper.io/images/test-sites/e-commerce/items/cart2.png,I misplaced my sony xperia somewhere in the library.,images/product_142_0.jpg,electronics,"Sony Xperia GPS, waterproof I misplaced my sony xperia somewhere in the library. electronics"
Asus VivoBook...,$399,"Asus VivoBook Max X541NA-GQ041 Black Chocolate, 15.6"" HD, Pentium N4200 1.1GHz, 4GB, 500GB, Windows 10 Home",https://webscraper.io/images/test-sites/e-commerce/items/cart2.png,I dropped my asus vivobook... near the parking area.,images/product_14_0.jpg,electronics,"Asus VivoBook... Asus VivoBook Max X541NA-GQ041 Black Chocolate, 15.6"" HD, Pentium N4200 1.1GHz, 4GB, 500GB, Windows 10 Home I dropped my asus vivobook... near the parking area. electronics"
LG Optimus,$57.99,"3.2"" screen",https://webscraper.io/images/test-sites/e-commerce/items/cart2.png,I misplaced my lg optimus somewhere in the library.,images/product_139_0.jpg,electronics,"LG Optimus 3.2"" screen I misplaced my lg optimus somewhere in the library. electronics"
Acer TravelMat...,$1170.1,"Acer TravelMate P645-S-511A Black, 14"" FHD IPS, Core i5-5200U, 8GB, 256GB SSD, 3G, Windows 10 Pro",https://webscraper.io/images/test-sites/e-commerce/items/cart2.png,I lost my acer travelmat... while commuting this morning.,images/product_85_0.jpg,electronics,"Acer TravelMat... Acer TravelMate P645-S-511A Black, 14"" FHD IPS, Core i5-5200U, 8GB, 256GB SSD, 3G, Windows 10 Pro I lost my acer travelmat... while commuting this morning. electronics"
Asus EeeBook R...,$433.3,"Asus EeeBook R416NA-FA014T, 14"" FHD, Pentium N4200, 4GB, 128GB eMMC, Windows 10 Home, Eng kbd",https://webscraper.io/images/test-sites/e-commerce/items/cart2.png,I think I left my asus eeebook r... in the lecture hall.,images/product_46_0.jpg,electronics,"Asus EeeBook R... Asus EeeBook R416NA-FA014T, 14"" FHD, Pentium N4200, 4GB, 128GB eMMC, Windows 10 Home, Eng kbd I think I left my asus eeebook r... in the lecture hall. electronics"
HP 350 G1,$577.99,"15.6"", Core i5-4200U, 4GB, 750GB, Radeon HD8670M 2GB, Windows",https://webscraper.io/images/test-sites/e-commerce/items/cart2.png,I misplaced my hp 350 g1 somewhere in the library.,images/product_13_0.jpg,electronics,"HP 350 G1 15.6"", Core i5-4200U, 4GB, 750GB, Radeon HD8670M 2GB, Windows I misplaced my hp 350 g1 somewhere in the library. electronics"
Acer TravelMat...,$1170.1,"Acer TravelMate P645-S-511A Black, 14"" FHD IPS, Core i5-5200U, 8GB, 256GB SSD, 3G, Windows 10 Pro",https://webscraper.io/images/test-sites/e-commerce/items/cart2.png,I lost my acer travelmat... while commuting this morning.,images/product_85_0.jpg,electronics,"Acer TravelMat... Acer TravelMate P645-S-511A Black, 14"" FHD IPS, Core i5-5200U, 8GB, 256GB SSD, 3G, Windows 10 Pro I lost my acer travelmat... while commuting this morning. electronics"
Lenovo V110-15...,$356.49,"Asus VivoBook 15 X540NA-GQ008T Chocolate Black, 15.6"" HD, Pentium N4200, 4GB, 500GB, Windows 10 Home, En kbd",https://webscraper.io/images/test-sites/e-commerce/items/cart2.png,My lenovo v110-15... went missing near the campus cafeteria.,images/product_33_0.jpg,electronics,"Lenovo V110-15... Asus VivoBook 15 X540NA-GQ008T Chocolate Black, 15.6"" HD, Pentium N4200, 4GB, 500GB, Windows 10 Home, En kbd My lenovo v110-15... went missing near the campus cafeteria. electronics"
MSI GL72M 7RDX,$1099,"Asus ROG Strix GL553VD-DM535T, 15.6"" FHD, Core i7-7700HQ, 8GB, 1TB + 128GB SSD, GeForce GTX 1050 2GB, Windows 10 Home, Eng kbd",https://webscraper.io/images/test-sites/e-commerce/items/cart2.png,My msi gl72m 7rdx went missing near the campus cafeteria.,images/product_66_0.jpg,electronics,"MSI GL72M 7RDX Asus ROG Strix GL553VD-DM535T, 15.6"" FHD, Core i7-7700HQ, 8GB, 1TB + 128GB SSD, GeForce GTX 1050 2GB, Windows 10 Home, Eng kbd My msi gl72m 7rdx went missing near the campus cafeteria. electronics"
Dell Latitude...,$1102.66,"Dell Latitude 5280, 12.5"" HD, Core i5-7300U, 8GB, 256GB SSD, Windows 10 Pro",https://webscraper.io/images/test-sites/e-commerce/items/cart2.png,I misplaced my dell latitude... somewhere in the library.,images/product_68_0.jpg,electronics,"Dell Latitude... Dell Latitude 5280, 12.5"" HD, Core i5-7300U, 8GB, 256GB SSD, Windows 10 Pro I misplaced my dell latitude... somewhere in the library. electronics"
Lenovo ThinkPa...,$999,"Lenovo ThinkPad L570, 15.6"" FHD, Core i7-7500U, 8GB, 256GB SSD, Windows 10 Pro",https://webscraper.io/images/test-sites/e-commerce/items/cart2.png,I dropped my lenovo thinkpa... near the parking area.,images/product_23_0.jpg,electronics,"Lenovo ThinkPa... Lenovo ThinkPad L570, 15.6"" FHD, Core i7-7500U, 8GB, 256GB SSD, Windows 10 Pro I dropped my lenovo thinkpa... near the parking area. electronics"
MSI GL62M 7REX,$1199,"MSI GL62M 7REX, 15.6"" FHD, Core i7-7700HQ, 8GB, 1TB + 128GB SSD, GeForce GTX 1050 Ti 2GB, Windows 10 Home",https://webscraper.io/images/test-sites/e-commerce/items/cart2.png,I misplaced my msi gl62m 7rex somewhere in the library.,images/product_90_0.jpg,electronics,"MSI GL62M 7REX MSI GL62M 7REX, 15.6"" FHD, Core i7-7700HQ, 8GB, 1TB + 128GB SSD, GeForce GTX 1050 Ti 2GB, Windows 10 Home I misplaced my msi gl62m 7rex somewhere in the library. electronics"
Dell Inspiron...,$1124.2,"Dell Inspiron 17 2in1 (7779) Silver, 17.3"" FHD Touch, Core i5-7200U, 12GB, 1TB, GeForce GT940MX 2GB, Windows 10 Home",https://webscraper.io/images/test-sites/e-commerce/items/cart2.png,Someone might have seen a dell inspiron... near the hostel area.,images/product_74_0.jpg,electronics,"Dell Inspiron... Dell Inspiron 17 2in1 (7779) Silver, 17.3"" FHD Touch, Core i5-7200U, 12GB, 1TB, GeForce GT940MX 2GB, Windows 10 Home Someone might have seen a dell inspiron... near the hostel area. electronics"
Asus VivoBook...,$399,"Asus VivoBook Max X541NA-GQ041 Black Chocolate, 15.6"" HD, Pentium N4200 1.1GHz, 4GB, 500GB, Windows 10 Home",https://webscraper.io/images/test-sites/e-commerce/items/cart2.png,I dropped my asus vivobook... near the parking area.,images/product_14_0.jpg,electronics,"Asus VivoBook... Asus VivoBook Max X541NA-GQ041 Black Chocolate, 15.6"" HD, Pentium N4200 1.1GHz, 4GB, 500GB, Windows 10 Home I dropped my asus vivobook... near the parking area. electronics"
Toshiba Porteg...,$1114.55,"Toshiba Portege Z30-C-16J Grey, 13.3"" FHD, Core i5-6200U, 8GB, 256GB SSD, Windows 10 Pro",https://webscraper.io/images/test-sites/e-commerce/items/cart2.png,I lost my toshiba porteg... near the bus stop yesterday evening.,images/product_71_0.jpg,electronics,"Toshiba Porteg... Toshiba Portege Z30-C-16J Grey, 13.3"" FHD, Core i5-6200U, 8GB, 256GB SSD, Windows 10 Pro I lost my toshiba porteg... near the bus stop yesterday evening. electronics"
Galaxy Tab 4,$233.99,"LTE (SM-T235), Quad-Core 1.2GHz, 8GB, Black",https://webscraper.io/images/test-sites/e-commerce/items/cart2.png,A galaxy tab 4 was reported missing near the main gate.,images/product_128_0.jpg,electronics,"Galaxy Tab 4 LTE (SM-T235), Quad-Core 1.2GHz, 8GB, Black A galaxy tab 4 was reported missing near the main gate. electronics"
MSI GL62VR 7RF...,$1299,"MSI GL62VR 7RFX, 15.6"" FHD, Core i7-7700HQ, 8GB, 1TB + 256GB SSD, GeForce GTX 1060 3GB, Windows 10 Home",https://webscraper.io/images/test-sites/e-commerce/items/cart2.png,I lost my msi gl62vr 7rf... near the bus stop yesterday evening.,images/product_104_0.jpg,electronics,"MSI GL62VR 7RF... MSI GL62VR 7RFX, 15.6"" FHD, Core i7-7700HQ, 8GB, 1TB + 256GB SSD, GeForce GTX 1060 3GB, Windows 10 Home I lost my msi gl62vr 7rf... near the bus stop yesterday evening. electronics"
Acer Predator...,$1187.98,"Acer Predator Helios 300 (PH317-51), 17.3"" FHD IPS, Core i7-7700HQ. 8GB, 128GB SSD +1TB, GeForce GTX 1050Ti 4GB, Linux + Windows 10 Home",https://webscraper.io/images/test-sites/e-commerce/items/cart2.png,I think I left my acer predator... in the lecture hall.,images/product_89_0.jpg,electronics,"Acer Predator... Acer Predator Helios 300 (PH317-51), 17.3"" FHD IPS, Core i7-7700HQ. 8GB, 128GB SSD +1TB, GeForce GTX 1050Ti 4GB, Linux + Windows 10 Home I think I left my acer predator... in the lecture hall. electronics"
Asus ROG Strix...,$1799,"Asus ROG Strix SCAR Edition GL503VM-ED115T, 15.6"" FHD 120Hz, Core i7-7700HQ, 16GB, 256GB SSD + 1TB SSHD, GeForce GTX 1060 6GB, Windows 10 Home",https://webscraper.io/images/test-sites/e-commerce/items/cart2.png,I misplaced my asus rog strix... somewhere in the library.,images/product_28_0.jpg,electronics,"Asus ROG Strix... Asus ROG Strix SCAR Edition GL503VM-ED115T, 15.6"" FHD 120Hz, Core i7-7700HQ, 16GB, 256GB SSD + 1TB SSHD, GeForce GTX 1060 6GB, Windows 10 Home I misplaced my asus rog strix... somewhere in the library. electronics"
Acer Extensa 1...,$439.73,"Acer Extensa 15 (2540) Black, 15.6"" HD, Core i5-7200U, 4GB, 500GB, Linux",https://webscraper.io/images/test-sites/e-commerce/items/cart2.png,My acer extensa 1... went missing near the campus cafeteria.,images/product_49_0.jpg,electronics,"Acer Extensa 1... Acer Extensa 15 (2540) Black, 15.6"" HD, Core i5-7200U, 4GB, 500GB, Linux My acer extensa 1... went missing near the campus cafeteria. electronics"
Acer Aspire ES...,$454.62,"Acer Aspire ES1-572 Black, 15.6"" HD, Core i5-7200U, 4GB, 500GB, Linux",https://webscraper.io/images/test-sites/e-commerce/items/cart2.png,I misplaced my acer aspire es... somewhere in the library.,images/product_50_0.jpg,electronics,"Acer Aspire ES... Acer Aspire ES1-572 Black, 15.6"" HD, Core i5-7200U, 4GB, 500GB, Linux I misplaced my acer aspire es... somewhere in the library. electronics"
Acer Predator...,$1123.87,"Acer Predator Helios 300 (PH317-51), 17.3"" FHD IPS, Core i5-7300HQ, 8GB, 1TB + 128GB SSD, GeForce GTX 1050Ti 4GB, Windows 10 Home",https://webscraper.io/images/test-sites/e-commerce/items/cart2.png,My acer predator... went missing near the campus cafeteria.,images/product_72_0.jpg,electronics,"Acer Predator... Acer Predator Helios 300 (PH317-51), 17.3"" FHD IPS, Core i5-7300HQ, 8GB, 1TB + 128GB SSD, GeForce GTX 1050Ti 4GB, Windows 10 Home My acer predator... went missing near the campus cafeteria. electronics"
Acer Spin 5,$564.98,"Acer Spin 5 SP513-51 Black, 13.3"" FHD Touch, Core i3-7100U, 4GB, 128GB SSD, Windows 10 Home",https://webscraper.io/images/test-sites/e-commerce/items/cart2.png,I lost my acer spin 5 near the bus stop yesterday evening.,images/product_16_0.jpg,electronics,"Acer Spin 5 Acer Spin 5 SP513-51 Black, 13.3"" FHD Touch, Core i3-7100U, 4GB, 128GB SSD, Windows 10 Home I lost my acer spin 5 near the bus stop yesterday evening. electronics"
Memo Pad HD 7,$101.99,"IPS, Dual-Core 1.2GHz, 8GB, Android 4.3",https://webscraper.io/images/test-sites/e-commerce/items/cart2.png,Someone might have seen a memo pad hd 7 near the hostel area.,images/product_130_0.jpg,electronics,"Memo Pad HD 7 IPS, Dual-Core 1.2GHz, 8GB, Android 4.3 Someone might have seen a memo pad hd 7 near the hostel area. electronics"
Asus MeMO Pad,$102.99,"7"" screen, Android, 8GB",https://webscraper.io/images/test-sites/e-commerce/items/cart2.png,I dropped my asus memo pad near the parking area.,images/product_119_0.jpg,electronics,"Asus MeMO Pad 7"" screen, Android, 8GB I dropped my asus memo pad near the parking area. electronics"
Asus ROG STRIX...,$899,"Asus ROG STRIX GL553VD-DM256, 15.6"" FHD, Core i5-7300HQ, 8GB, 1TB, GeForce GTX 1050 2GB, No OS + Windows 10 Home",https://webscraper.io/images/test-sites/e-commerce/items/cart2.png,I misplaced my asus rog strix... somewhere in the library.,images/product_22_0.jpg,electronics,"Asus ROG STRIX... Asus ROG STRIX GL553VD-DM256, 15.6"" FHD, Core i5-7300HQ, 8GB, 1TB, GeForce GTX 1050 2GB, No OS + Windows 10 Home I misplaced my asus rog strix... somewhere in the library. electronics"
Pavilion,$609.99,"15.6"", Core i5-4200U, 6GB, 750GB, Windows 8.1",https://webscraper.io/images/test-sites/e-commerce/items/cart2.png,My pavilion went missing near the campus cafeteria.,images/product_7_0.jpg,electronics,"Pavilion 15.6"", Core i5-4200U, 6GB, 750GB, Windows 8.1 My pavilion went missing near the campus cafeteria. electronics"
Acer Aspire 3...,$436.29,"Acer Aspire 3 A315-51, 15.6"" HD, Core i3-6006U, 4GB, 1TB, Windows 10 Home",https://webscraper.io/images/test-sites/e-commerce/items/cart2.png,I lost my acer aspire 3... near the bus stop yesterday evening.,images/product_47_0.jpg,electronics,"Acer Aspire 3... Acer Aspire 3 A315-51, 15.6"" HD, Core i3-6006U, 4GB, 1TB, Windows 10 Home I lost my acer aspire 3... near the bus stop yesterday evening. electronics"
MeMo PAD FHD 1...,$320.99,"White, 10.1"" IPS, 1.6GHz, 2GB, 16GB, Android 4.2",https://webscraper.io/images/test-sites/e-commerce/items/cart2.png,Someone might have seen a memo pad fhd 1... near the hostel area.,images/product_132_0.jpg,electronics,"MeMo PAD FHD 1... White, 10.1"" IPS, 1.6GHz, 2GB, 16GB, Android 4.2 Someone might have seen a memo pad fhd 1... near the hostel area. electronics"
Lenovo V110-15...,$454.73,"Lenovo V110-15ISK, 15.6"" HD, Core i3-6006U, 4GB, 128GB SSD, Windows 10 Pro",https://webscraper.io/images/test-sites/e-commerce/items/cart2.png,I dropped my lenovo v110-15... near the parking area.,images/product_51_0.jpg,electronics,"Lenovo V110-15... Lenovo V110-15ISK, 15.6"" HD, Core i3-6006U, 4GB, 128GB SSD, Windows 10 Pro I dropped my lenovo v110-15... near the parking area. electronics"
Ubuntu Edge,$499.99,Sapphire glass,https://webscraper.io/images/test-sites/e-commerce/items/cart2.png,I dropped my ubuntu edge near the parking area.,images/product_143_0.jpg,electronics,Ubuntu Edge Sapphire glass I dropped my ubuntu edge near the parking area. electronics
Lenovo V110-15...,$321.94,"Lenovo V110-15IAP, 15.6"" HD, Celeron N3350 1.1GHz, 4GB, 128GB SSD, Windows 10 Home",https://webscraper.io/images/test-sites/e-commerce/items/cart2.png,A lenovo v110-15... was reported missing near the main gate.,images/product_32_0.jpg,electronics,"Lenovo V110-15... Lenovo V110-15IAP, 15.6"" HD, Celeron N3350 1.1GHz, 4GB, 128GB SSD, Windows 10 Home A lenovo v110-15... was reported missing near the main gate. electronics"
Acer Aspire ES...,$379.95,"Acer Aspire ES1-572 Black, 15.6"" HD, Core i3-6006U, 4GB, 128GB SSD, Linux",https://webscraper.io/images/test-sites/e-commerce/items/cart2.png,My acer aspire es... went missing near the campus cafeteria.,images/product_37_0.jpg,electronics,"Acer Aspire ES... Acer Aspire ES1-572 Black, 15.6"" HD, Core i3-6006U, 4GB, 128GB SSD, Linux My acer aspire es... went missing near the campus cafeteria. electronics"
Dell Latitude...,$1143.4,"Dell Latitude 5480, 14"" FHD, Core i5-7440HQ, 8GB, 256GB SSD, Windows 10 Pro",https://webscraper.io/images/test-sites/e-commerce/items/cart2.png,I think I left my dell latitude... in the lecture hall.,images/product_79_0.jpg,electronics,"Dell Latitude... Dell Latitude 5480, 14"" FHD, Core i5-7440HQ, 8GB, 256GB SSD, Windows 10 Pro I think I left my dell latitude... in the lecture hall. electronics"
Acer Aspire 3...,$372.7,"Acer Aspire 3 A315-31 Black, 15.6"" HD, Celeron N3350 1.1GHz, 4GB, 128GB SSD, Windows 10 Home",https://webscraper.io/images/test-sites/e-commerce/items/cart2.png,I think I left my acer aspire 3... in the lecture hall.,images/product_35_0.jpg,electronics,"Acer Aspire 3... Acer Aspire 3 A315-31 Black, 15.6"" HD, Celeron N3350 1.1GHz, 4GB, 128GB SSD, Windows 10 Home I think I left my acer aspire 3... in the lecture hall. electronics"
Asus VivoBook...,$295.99,"Asus VivoBook X441NA-GA190 Chocolate Black, 14"", Celeron N3450, 4GB, 128GB SSD, Endless OS, ENG kbd",https://webscraper.io/images/test-sites/e-commerce/items/cart2.png,A asus vivobook... was reported missing near the main gate.,images/product_29_0.jpg,electronics,"Asus VivoBook... Asus VivoBook X441NA-GA190 Chocolate Black, 14"", Celeron N3450, 4GB, 128GB SSD, Endless OS, ENG kbd A asus vivobook... was reported missing near the main gate. electronics"
Asus ROG Strix...,$1101.83,"Apple MacBook Air 13.3"", Core i5 1.8GHz, 8GB, 128GB SSD, Intel HD 4000, RUS",https://webscraper.io/images/test-sites/e-commerce/items/cart2.png,My asus rog strix... went missing near the campus cafeteria.,images/product_67_0.jpg,electronics,"Asus ROG Strix... Apple MacBook Air 13.3"", Core i5 1.8GHz, 8GB, 128GB SSD, Intel HD 4000, RUS My asus rog strix... went missing near the campus cafeteria. electronics"
Acer Aspire 3...,$408.98,"Acer Aspire 3 A315-31 Black, 15.6"" HD, Pentium N4200 1.1GHz, 4GB, 128GB SSD, Windows 10 Home",https://webscraper.io/images/test-sites/e-commerce/items/cart2.png,I lost my acer aspire 3... near the bus stop yesterday evening.,images/product_42_0.jpg,electronics,"Acer Aspire 3... Acer Aspire 3 A315-31 Black, 15.6"" HD, Pentium N4200 1.1GHz, 4GB, 128GB SSD, Windows 10 Home I lost my acer aspire 3... near the bus stop yesterday evening. electronics"
Asus ROG Strix...,$1259,"Asus ROG Strix GL753VE-GC096T, 17.3"" FHD, Core i7-7700HQ, 8GB, 1TB + 128GB SSD, GeForce GTX 1050 Ti 4GB, Windows 10 Home, Eng kbd",https://webscraper.io/images/test-sites/e-commerce/items/cart2.png,I lost my asus rog strix... near the bus stop yesterday evening.,images/product_99_0.jpg,electronics,"Asus ROG Strix... Asus ROG Strix GL753VE-GC096T, 17.3"" FHD, Core i7-7700HQ, 8GB, 1TB + 128GB SSD, GeForce GTX 1050 Ti 4GB, Windows 10 Home, Eng kbd I lost my asus rog strix... near the bus stop yesterday evening. electronics"
Iconia B1-730H...,$99.99,"Black, 7"", 1.6GHz Dual-Core, 8GB, Android 4.4",https://webscraper.io/images/test-sites/e-commerce/items/cart2.png,My iconia b1-730h... went missing near the campus cafeteria.,images/product_134_0.jpg,electronics,"Iconia B1-730H... Black, 7"", 1.6GHz Dual-Core, 8GB, Android 4.4 My iconia b1-730h... went missing near the campus cafeteria. electronics"
